{
  "schema_version": "1.0.0",
  "run_id": "20260323T004220Z-par-parallel-reduction-rust-baseline",
  "benchmark": {
    "id": "par-parallel-reduction",
    "category": "parallelism",
    "benchmark_tier": "component",
    "architectural_analog": "analytics reduction stage / batch parallel worker reduction"
  },
  "implementation": {
    "language": "rust",
    "runtime": "bootstrap-local",
    "mode": "baseline",
    "implementation_version": "git:9c2105b"
  },
  "parameters": {
    "input_size": "200000",
    "trial": 2,
    "warmup_completed": true
  },
  "metrics": {
    "wall_time_ms": 161.967,
    "cpu_percent_avg": 7.692,
    "cpu_percent_peak": 7.692,
    "mem_peak_mb": 1.922,
    "exit_code": 0
  },
  "quality": {
    "correctness_passed": true,
    "warnings": []
  },
  "timestamps": {
    "started_at": "2026-03-23T00:42:21Z",
    "finished_at": "2026-03-23T00:42:21Z"
  }
}
