{
  "schema_version": "1.0.0",
  "run_id": "20260322T235251Z-con-producer-consumer-pipeline-rust-baseline",
  "benchmark": {
    "id": "con-producer-consumer-pipeline",
    "category": "concurrency",
    "benchmark_tier": "component",
    "architectural_analog": "bounded internal pipeline / worker queue"
  },
  "implementation": {
    "language": "rust",
    "runtime": "bootstrap-local",
    "mode": "baseline",
    "implementation_version": "git:85fd895"
  },
  "parameters": {
    "input_size": "100000",
    "trial": 3,
    "warmup_completed": true
  },
  "metrics": {
    "wall_time_ms": 197.987,
    "cpu_percent_avg": 77.778,
    "cpu_percent_peak": 77.778,
    "mem_peak_mb": 1.781,
    "exit_code": 0
  },
  "quality": {
    "correctness_passed": true,
    "warnings": []
  },
  "timestamps": {
    "started_at": "2026-03-22T23:52:52Z",
    "finished_at": "2026-03-22T23:52:52Z"
  }
}
