{
  "schema_version": "1.0.0",
  "run_id": "20260322T220556Z-mem-large-json-transform-python-baseline",
  "benchmark": {
    "id": "mem-large-json-transform",
    "category": "memory",
    "benchmark_tier": "component",
    "architectural_analog": "ETL transform stage / ingestion service"
  },
  "implementation": {
    "language": "python",
    "runtime": "bootstrap-local",
    "mode": "baseline",
    "implementation_version": "git:cbea13b"
  },
  "parameters": {
    "input_size": "benchmarks/datasets/generated/mem-large-json-transform-medium.json",
    "trial": 2,
    "warmup_completed": true
  },
  "metrics": {
    "wall_time_ms": 75.455,
    "cpu_percent_avg": 100.0,
    "cpu_percent_peak": 100.0,
    "mem_peak_mb": 42.594,
    "exit_code": 0
  },
  "quality": {
    "correctness_passed": true,
    "warnings": []
  },
  "timestamps": {
    "started_at": "2026-03-22T22:05:57Z",
    "finished_at": "2026-03-22T22:05:57Z"
  }
}
