{
  "schema_version": "1.0.0",
  "run_id": "20260322T184223Z-cpu-prime-count-python-baseline",
  "benchmark": {
    "id": "cpu-prime-count",
    "category": "cpu",
    "benchmark_tier": "micro",
    "architectural_analog": "pure compute validation engine"
  },
  "implementation": {
    "language": "python",
    "runtime": "bootstrap-local",
    "mode": "baseline",
    "implementation_version": "git:d50232e"
  },
  "parameters": {
    "input_size": 500000,
    "trial": 3,
    "warmup_completed": true
  },
  "metrics": {
    "wall_time_ms": 32.184,
    "cpu_percent_avg": 0,
    "cpu_percent_peak": 0,
    "mem_peak_mb": 12.547,
    "exit_code": 0
  },
  "quality": {
    "correctness_passed": true,
    "warnings": []
  },
  "timestamps": {
    "started_at": "2026-03-22T18:42:23Z",
    "finished_at": "2026-03-22T18:42:23Z"
  }
}
