{
  "schema_version": "1.0.0",
  "run_id": "20260323T000223Z-io-large-file-streaming-typescript-baseline",
  "benchmark": {
    "id": "io-large-file-streaming",
    "category": "io",
    "benchmark_tier": "component",
    "architectural_analog": "file ingestion / streaming transform stage"
  },
  "implementation": {
    "language": "typescript",
    "runtime": "bootstrap-local",
    "mode": "baseline",
    "implementation_version": "git:a6f8f6c"
  },
  "parameters": {
    "input_size": "benchmarks/datasets/generated/io-large-file-streaming-medium.txt",
    "trial": 1,
    "warmup_completed": true
  },
  "metrics": {
    "wall_time_ms": 98.965,
    "cpu_percent_avg": 100.0,
    "cpu_percent_peak": 100.0,
    "mem_peak_mb": 61.422,
    "exit_code": 0
  },
  "quality": {
    "correctness_passed": true,
    "warnings": []
  },
  "timestamps": {
    "started_at": "2026-03-23T00:02:23Z",
    "finished_at": "2026-03-23T00:02:23Z"
  }
}
