{
  "schema_version": "1.0.0",
  "run_id": "20260322T221834Z-mem-large-json-transform-rust-baseline",
  "benchmark": {
    "id": "mem-large-json-transform",
    "category": "memory",
    "benchmark_tier": "component",
    "architectural_analog": "ETL transform stage / ingestion service"
  },
  "implementation": {
    "language": "rust",
    "runtime": "bootstrap-local",
    "mode": "baseline",
    "implementation_version": "git:239ae35"
  },
  "parameters": {
    "input_size": "benchmarks/datasets/generated/mem-large-json-transform-medium.json",
    "trial": 1,
    "warmup_completed": true
  },
  "metrics": {
    "wall_time_ms": 283.287,
    "cpu_percent_avg": 0,
    "cpu_percent_peak": 0,
    "mem_peak_mb": 11.188,
    "exit_code": 0
  },
  "quality": {
    "correctness_passed": true,
    "warnings": []
  },
  "timestamps": {
    "started_at": "2026-03-22T22:18:35Z",
    "finished_at": "2026-03-22T22:18:35Z"
  }
}
